"मेरी आँख और दिल के बीच एक समझौता हो गया है,
और प्रत्येक अब एक दूसरे के लिए अच्छा काम करता है:
जब मेरी आँख एक झलक के लिए भूखा होती है,
या दिल में आत्म-भक्ति से अपना आत्मा दबा लेता है,

तो मेरी आँख मेरे प्रेम की छवि से भोग करती है,
और रंगीन भोज को मेरे दिल को आमंत्रित करती है;
एक और समय मेरी आँख मेरे दिल का मेहमान है,
और उसके प्रेम के विचारों में भागीदारी करती है।

तो, तेरी तस्वीर या मेरे प्रेम द्वारा,
तू हमेशा मेरे साथ है;
क्योंकि तू मेरी सोचों से दूर नहीं जा सकती,
और मैं उनके साथ हूँ, और वे तेरे साथ हैं;

  या अगर वे सो जाएं, तो मेरी आँखों में तेरी तस्वीर
  अपने दिल को दिल और आँखों की आनंद में जगाती है।"
"मैं कितना सावधान था, जब मैंने अपना रास्ता बनाया,
हर छोटी बात को सबसे सत्य बार में धकेलने के लिए,
ताकि मेरे उपयोग के लिए यह अव्याय रहे
झूठ के हाथों से, निश्चित विश्वास के सुरक्षित द्वारों में!

लेकिन तू, जिसे मेरे गहने छोटी बातें हैं,
सबसे अच्छा सांत्वना, अब मेरी सबसे बड़ी दुख,
तू, सबसे अच्छा प्रिय और मेरी केवल देखभाल,
हर सामान्य चोर की शिकार छोड़ा गया है।

मैंने तुझे किसी बक्से में बंद नहीं किया है,
जहां तू नहीं है, हालांकि मैं महसूस करता हूँ कि तू है,
मेरे स्तन की कोमल बंदी के अंदर,
जहां से तू अपनी इच्छा के अनुसार आ सकती है और जा सकती है;

  और यहीं से मैं डरता हूँ कि तू चुराई जाएगी,
  क्योंकि सच्चाई इतनी मूल्यवान पुरस्कार के लिए चोर हो जाती है।"
"उस समय के खिलाफ, यदि कभी वह समय आए,
जब मैं तुझपर अपनी दोषों की मुँह दिखाई देगा,
जब तेरा प्रेम अपनी अधिकतम योगदान को हानि हो गया है,
सोच-विचार के माध्यम से उस मुक़ाबले के लिए;

उस समय के खिलाफ जब तू अजीब तरीके से चलेगा,
और उस सूर्य जैसे आंख से मुझे लगभग अभिवादन नहीं करेगा,
जब प्रेम, जो किसी चीज से बदल गया हो,
स्थायी गुरुत्व के कारण का पता लगाएगा;

उस समय के खिलाफ, मैं यहाँ छिपा हूँ,
अपनी खुद की जानकारी के भीतर,
और यह मेरा हाथ खुद को उठाता है,
तेरी ओर से कानूनी कारणों की रक्षा करने के लिए;

  मेरे को छोड़ने के लिए, तुझे कानून की शक्ति है,
  क्योंकि मैं प्रेम के लिए कोई कारण नहीं दे सकता।"
"मैं रास्ते पर कितना भारी हूँ,
जब मैं जो खोज रहा हूँ, मेरी थकी हुई यात्रा का समापन,
वह सिखाता है कि आराम और विश्राम कहने के लिए,
'इस तरह मील तेरे दोस्त से मापी गई है!'

जो जानवर मुझे ले जाता है, मेरे दुख से थका हुआ,
उसने मेरे अंदर उस वजन को बोझित करने के लिए धीमा कदम बढ़ाया,
जैसे कि कुछ अंतर्निहित बुद्धिमत्ता से दुर्बल ने जाना है
कि उसका यात्री चाल को पसंद नहीं करता, तू से बना है।

रक्तित स्पर उसे आगे बढ़ाने में सक्षम नहीं है,
जो कभी-कभी क्रोध उसकी खाल में धकेलता है;
जिसका वह दुख से उत्तर देता है,
मेरे लिए उसके पार्श्व की तुलना में अधिक तीक्ष्ण;

  क्योंकि वही ग्रोन मेरी इस बात को मेरे मन में डालता है,
  मेरा दुःख आगे है, और मेरा आनंद पीछे है।"
"इस प्रकार मेरा प्रेम मेरी निर्धन अपराध क्षमा कर सकता है
मेरे धीरे-धीरे चलने वाले की, जब मैं तुझसे दूर चला जाता हूँ:
तुझसे दूर क्यों होना चाहिए मुझे?
जब तक मैं वापस नहीं आता, फिर तेजी से कोई आवश्यकता नहीं है।

ओ! मेरे गरीब जानवर को फिर कौन सी क्षमा मिलेगी,
जब तेज़ अवस्था को धीमी होने का दृष्टांत हो सकता है?
तब मुझे कूदना चाहिए, हवा पर चढ़ा होने के बावजूद;
पंखों वाली गति में मुझे कोई चाल नहीं मिलेगी।

तब मेरी इच्छा को कोई घोड़ा नहीं रख सकता,
इसलिए इच्छा, पूर्ण प्रेम की बनाई गई,
उसकी आग दौड़ में (कोई कुंजी नहीं) नाचेगा;
लेकिन प्रेम, प्रेम के लिए, मेरे गदे को इस क्षमा करेगा:

  क्योंकि तुझसे जा रहे वह इच्छाशक्ति-धीमा गया,
  तेरी ओर मैं दौड़ूंगा, और मुझे उसे जाने की छूट देने का आदान-प्रदान करूंगा।"
"इसलिए मैं धनी जो किसी के धन्य कुंजी की तरह हूँ,
जो उसे उसके मिठे ताले की खजाने में ले जा सकती है,
जिसे उसने हर घंटे नहीं देखेगा,
क्योंकि बार-बार आने से कमजोर आनंद की तीक्ष्ण बिंदु को।

इसलिए उत्सव इतने साक्षात्कारपूर्ण और इतने दुर्लभ हैं,
क्योंकि वह इस लंबे साल में कभी-कभी आता है,
मूल्यवान पत्थरों की तरह वे धीरे-धीरे रखे जाते हैं,
या हार में कप्तान मणि।

इसलिए समय है जो तुम्हें मेरे संग रखता है,
या जैसा कि वस्त्रालय जिसमें वस्त्र छिपा होता है,
किसी विशेष समय को विशेष-धन्य बनाने के लिए,
उसके बंद प्रमाण को नए खुलने से।

  तुम्हारे योग्यता जो स्थान देती है,
  प्रशंसा करने के लिए प्राप्त होने पर, आशा के लिए अभाव के लिए।"
