"कौन मेरी पंक्तियों को आने वाले समय में विश्वास करेगा,
अगर इसमें तुम्हारी सर्वोच्च प्रशंसाओं से भरा हो?
हालांकि ईश्वर जानता है कि यह केवल एक मकबरा है
जो तुम्हारे जीवन को छुपाता है, और तुम्हारे सभी हिस्सों को दिखाता नहीं है।
अगर मैं तुम्हारी आंखों की सुंदरता को लिख सकता,
और तुम्हारी सभी श्रृंगारों को ताजगी से गिन सकता,
तो आने वाली युग कहेगा 'यह कवि झूठा है;
ऐसी दिव्य स्पर्श कभी पृथ्वीलिंगों को नहीं मिले हैं।'
तो मेरे कागज़, जिनकी आयु से पीला हो गया है,
उन्हें बुजुर्गों की तरह तुच्छित किया जाएगा, जो जीभ से कम सत्य हों,
और तुम्हारा सच्चा अधिकार को कवि के क्रोध कहा जाएगा,
और पुराने गीत के विस्तृत छंद:
  लेकिन यदि तुम्हारा कोई बच्चा उस समय जीवित होता है,
  तो तुम उसमें और मेरे रचना में दोबारा जीते होते।"
"क्या मैं तुझे एक गर्मी के दिन की तुलना करूँ?
तू अधिक प्रिय और अधिक सामंजस्यपूर्ण है:
सख्त हवाएँ मई के प्यारे बटनों को हिला देती हैं,
और गर्मी की अवधि का समय बहुत छोटा है:

कभी-कभी आसमान की आंख बहुत गरम चमकती है,
और अक्सर उसका सोने का रूप धूप हो जाता है;
और हर सुंदरता से कभी-कभी कमी होती है,
किसी या प्राकृतिक परिवर्तन के अतीत के रूप में;

लेकिन तुझे शाश्वत गर्मी कभी नहीं होगी,
न तू उस सुंदरता को खोएगा जो तुझे है;
न यही कहेगा मौत कि तू उसकी छाया में घूम रहा है,
जब समय के लिए शाश्वत रेखाओं में तू बढ़ता है:

  जब तक लोग सांस ले सकते हैं या आँखें देख सकती हैं,
  तब तक यह जीवित रहेगा, और यह तुझे जीवन देगा।"
"समय, तू शेर के पंजे को कुंजील कर दे,
और पृथ्वी को उसके स्वयं मिठे संतानों को खा जाने दे;
कठिन बच्छे के दांत उगल ले, क्रूर बाघ के जबड़े से,
और उसके रक्त में दीपांतर में जला दे;

जैसे तू फिरता है, खुश और दुःखद ऋतुएँ बना दे,
और जो भी तू चाहे कर, चलते कदम समय,
सम्पूर्ण विश्व और उसकी सभी बिखरती मिठासों के लिए;
लेकिन मैं तुझे एक अत्यंत घोर अपराध से रोकता हूँ:

ओ! तेरी घड़ियालों से मेरे प्रेम की सुंदर चोटी को न काट,
न तू वहां अपनी पुरानी कलम के साथ कोई रेखाएँ बना;
उसे तेरे पथ में अविकृत कर दे
सुशीलता के उदाहरण के रूप में आने वाले लोगों के लिए।

  फिर भी, कर ले अपना सबसे खराब समय: तेरी ग़लती के बावजूद,
  मेरा प्रेम मेरी कविता में हमेशा ताजगी से जीवित रहेगा।"
"एक महिला का चेहरा प्राकृतिक स्वयं के हाथ से बनाया गया है
तुमने, मेरे प्रेम के प्रमुख-पति;
एक महिला का कोमल हृदय, लेकिन नहीं मिला
बदलते रूप, जैसा कि झूठे स्त्रीयों का फैशन है:
उनकी से अधिक चमकती आंख, लेकिन उनके झूठे घूमने में कम,
जिस पर यह जल्दी है वह ब्यूटी को चाँदनी देना;
रंग में एक पुरुष, उसके नियंत्रण में सभी 'रंग',
जो आदमियों की आंखें और स्त्रीयों की आत्माएँ आश्चर्यचकित करती हैं।
और एक महिला के लिए तुम पहले बनाए गए थे;
तब प्राकृतिकता, जैसे ही वह तुम्हें बना रही थी, भटक गई थी,
और जोड़कर मुझसे हार गई थी,
मेरी दृष्टिकोण को कुछ करके न करके बढ़ाकर।
  लेकिन क्योंकि उसने तुम्हें स्त्रीयों के आनंद के लिए उठाया था,
  मेरा प्रेम और तुम्हारे प्रेम का उपयोग उनकी धनी है।"
"तो मेरे साथ वैसा नहीं है जैसा उस कवि के साथ है
जिसने अपनी कविता के लिए एक रंगीन सौंदर्य को उत्तेजित किया है,
जो स्वर्ग स्वयं सजाने के लिए काम में लेता है,
और हर सुंदरता को अपने सुंदर से बार-बार करता है;
अपने स्वीकृति के साथ एक ताक़ती संबंध बनाना,
सूरज और चंद्रमा के साथ, पृथ्वी और समुद्र के समृद्धि रत्नों के साथ,
अप्रैल के पहले जन्मे फूलों के साथ, और सभी चीजें दुर्लभ हैं
जो स्वर्ग का वायु इस बड़े वृत्त में बंधी है।
ओ! आइए मुझे, प्रेम में सच्चे, लेकिन सच्चे रूप से लिखने दो,
और फिर मुझ पर विश्वास करो, मेरा प्रेम किसी भी मां के बच्चे की तरह है,
जो कि इतना चमकदार नहीं है जितना कि स्वर्ग के वायु में फिक्स किए गए वहाँ
  जो अच्छी बातें कहते हैं जो अच्छी बातें पसंद करते हैं;
  मैं उसे नहीं प्रशंसा करूंगा जो उद्देश्य को नहीं बेचता है।"
"मेरी चादर मुझे यह नहीं मनाएगी कि मैं बूढ़ा हूँ,
तब तक जब तक युवा और तू एक ही दिन की हो;
लेकिन जब मैं तुझमें समय की गहरी छालें देखता हूँ,
तब मैं मौत को देखता हूँ जो मेरे दिनों का प्रायश्चित करेगी।
क्योंकि तू में वह सभी सुंदरता जो है,
सिर्फ मेरे दिल के सुबीजी वस्त्र है,
जो तुझे ब्रेस्ट में रहता है, जैसा कि मेरा मुझमें;
फिर मैं तुझसे बड़ा तो कैसे हो सकता हूँ?
ओ! इसलिए प्रेम, अपने आप से सतर्क रहो,
जैसा कि मैं, न कि मेरे लिए, बल्कि तेरे लिए हूँ;
तेरे दिल को सहता हूँ, जिसे मैं इतना सावधानी से रखूंगा
जैसा कि कोई कुशल नर्स अपने शिशु को बुराई से बचाए।
  जब मेरा दिल मारा जाए तो अपने दिल पर धारा न करो,
  तूने मेरे को अपना दिया, वापस नहीं करने के लिए।"
"जैसे कि एक अधूरे अभिनेता जो मंच पर,
जिसे उसके भय ने उसकी भूमिका के पास रख दिया है,
या कुछ जोशीली वस्तु जो बहुत रोष से भरी होती है,
जिसकी शक्ति की प्रचुरता उसके ख़ुद के दिल को कमज़ोर कर देती है।

तो मैं, विश्वास के भय से, भूल जाता हूँ कहना
प्रेम के अनूप कर्मकांड को,
और अपने ही प्रेम की शक्ति में कमजोर लगने लगता हूँ,
अपने ही प्रेम की ताक़त के बोझ से लदा हुआ।

ओ! तब मेरे दृष्टि हो जाएँ उस अभिवादन की
और मेरी बोलती हुई छाती के मूढ़ संकेतकार,
जो प्रेम के लिए प्रतिष्ठा करते हैं, और पुरस्कृति की अपेक्षा करते हैं,
उस जीभ से जो अधिक व्यक्त करती है।

  ओ! सीखो यह कैसे की सूची गई चुप्पी को:
  आँखों से सुनना प्रेम की शानदार बुद्धिमत्ता का हिस्सा है।"
"मेरी आँख ने रंगारूपकार की भूमिका निभाई है और स्थापित की है,
तेरी सुंदरता का रूप मेरे दिल की तालिका में;
मेरा शरीर है वह फ़्रेम जिसमें यह रखा गया है,
और उदारदृष्टि जो सबसे अच्छे रंगारूपकार की कला है।

क्योंकि रंगारूपकार के माध्यम से तुम्हें उसकी कला दिखनी चाहिए,
ताकि तुम्हें यह पता चले कि तुम्हारी सच्ची छवि कहाँ चित्रित है;
जो मेरे हृदय की दुकान में अब भी लटका हुआ है,
जिसमें तेरी आंखों से सजे हुए खिड़कियाँ हैं।

अब देखो कि आंखों ने आंखों के लिए क्या अच्छा किया है:
मेरी आंखों ने तुम्हारे आकार को बनाया है, और तुम्हारे लिए मेरे लिए
मेरी छाती की ओर खिड़कियाँ हैं, जिससे सूर्य
खिड़की में झाँकने का आनंद लेता है, तुझपर देखने के लिए;
  तथापि इस कला को श्रृंगार देने की इच्छा है,
  वे केवल वह बनाते हैं जो वे देखते हैं, दिल को नहीं जानते।"
"वे जो अपने नक्षत्रों के साथ प्रिय हैं,
जन सम्मान और गर्वनीय उपाधियों का गर्व करें,
जबकि मैं, जिसको इस प्रकार की जीत की नसीब नहीं है,
उन्नति में उस चीज में अनपेक्षित आनंद है जिसे मैं सबसे अधिक मानता हूँ।

महाराजों के पसंदीदा अपने सुंदर पत्तियाँ छोड़ते हैं
लेकिन सूर्य की आंख में गेंदा की तरह,
और उनमें उनका गर्व दफन है,
क्योंकि एक मुस्कान पर वे अपने महिमा में मर जाते हैं।

योद्धा, जो युद्ध के लिए प्रसिद्ध है,
हजारों जीतों के बाद, एक बार हारा हुआ,
उनके सम्मान की किताब से पूरी तरह से मिटा दी जाती है,
और जिसके लिए उसने प्रयास किया, वह सब भूल जाते हैं:

  तब मैं खुश हूं, जो प्रेम करता हूं और प्रेम में हूं,
  जहां मैं हटा नहीं सकता और हटाया नहीं जा सकता।"
"मेरे प्रेम के भगवान, जिन्हें गुलामी में
तेरी महत्वकांक्षा ने मेरी कर्तव्य को मजबूती से जोड़ा है;
तुझे इस लिखित दूतावास में भेजता हूँ,
कर्तव्य को साक्षात न करने, मेरी बुद्धिमत्ता दिखाने के लिए नहीं।

कर्तव्य इतना महान, जिसे मेरी तरह शब्द कम
इसे दिखाने के लिए नग़ार, इसे दिखाने के लिए,
लेकिन मैं उम्मीद करता हूं कि तुम्हारे अच्छे विचार
तुम्हारी आत्मा के विचार में, सभी नंगे, उसे प्रदान करेंगे:

जब भी मेरे चलन का कोई तारा हो,
श्रीगणेश के साथ कृपाशील रूप से,
और मेरे फटे हुए प्रेम पर वस्त्र डालता है,
मुझे अपने मिठे सम्मान के लायक दिखाने के लिए:

  तब मैं यह कहने का हिम्मत कर सकता हूं कि मैं तुमसे कैसे प्रेम करता हूं;
  तब तक, मेरा सिर न दिखाऊं, जहां तू मुझे परीक्षण कर सकता है।"
"थका हुआ काम से, मैं अपने बिस्तर की ओर बढ़ता हूं,
यह प्रिय विश्राम थके हुए साँस के लिए;
लेकिन तब मेरे मस्तिष्क में एक यात्रा शुरू होती है,
मेरे मन का काम, जब शरीर का काम समाप्त होता है:

क्योंकि फिर मेरे विचार, जहाँ से मैं रहता हूँ,
तुझसे मिलने के लिए एक उत्सुक तीर्थयात्रा करना,
और मेरी झुरी हुई पलकें खुली रहती हैं,
अँधेरे पर देख रहा हूँ जो अंधे देखते हैं:

केवल इस बात से कि मेरी आत्मा की काल्पनिक दृष्टि
मेरी दृष्टि को मेरी दृष्टि से दृश्य में प्रस्तुत करती है,
जो, जैसे कि भूत रात में लटका हुआ,
काली रात को सुंदर बनाता है, और उसका पुराना चेहरा नया बनाता है।

  देखो! इस प्रकार, दिन में मेरे अंग, रात में मेरा मन,
  तेरे लिए, और अपने लिए, शांति नहीं पाते हैं।"
"तब मैं कैसे खुश विराम में लौट सकता हूं,
जो आराम का लाभ बंद कर दिया गया है?
जब दिन की दुर्बलता रात से धीरे-धीरे नहीं होती है,
लेकिन दिन से रात, और रात से दिन, दुखित हूँ?

और प्रत्येक, हालांकि एक दूसरे के शासन के दुश्मन हैं,
सहमति में मेरे साथ हाथ मिलाकर मुझे कष्ट पहुँचाते हैं;
एक पर कष्ट, दूसरे पर शिकायत करने के लिए
मैं जितना भी कष्ट हो, तुझसे और दूर हूँ।

मैं दिन को कहता हूं, उन्हें खुश करने के लिए तुम उज्ज्वल हो,
और जब बादल आकाश को छुपा लेते हैं, तब वह उसे श्रृंगारित करता हूं:
तो मैं रात को स्वार्थ-रंगीन बनाता हूं,
जबकि चमकीले तारे मुझसे झिलमिल नहीं करते हैं, तुम शाम को सजाते हो।

  लेकिन दिन दिनांक मेरी दुःख को और बढ़ाता है,
  और रात रात भर दुःख की लंबाई को मजबूत बनाती है।"
"जब, भाग्य और लोगों की नज़र में अपमान होता है,
मैं अकेला अपनी निर्वासन स्थिति को रोता हूँ,
और अपनी बेनियाज़ी की बेकार क़्लेम से ब्रह्मण करता हूँ,
और खुद पर देखता हूँ, और अपनी किस्मत को शापित करता हूँ,

अपने आप को एक आशा में और धनी की तरह चाहिए,
जैसा कि उसके साथ चित्रित है, उसके जैसा,
इस आदमी की कला की इच्छा है, और उस आदमी की राह,
जिसके साथ मैं सबसे अधिक आनंदित हूँ, सबसे कम।

तब इन विचारों में खुद को लगभग तिरस्कृत करते हुए,
हापली, मैं तुझपर सोचता हूँ— और तब मेरी स्थिति,
ब्रह्मण के द्वार पर हिम्स गाते हुए उठते दिन की तरह
धूप के सुदृढ़ धरती से, यह गाती है:

  क्योंकि तेरे मिठे प्रेम को याद करने से ऐसा धन लाया जाता है
  कि फिर मैं राजाओं के साथ अपनी स्थिति को बदलने से इनकार करता हूँ।"
"जब मीठे शांत विचारों की सभा में
मैं गुजरे हुए बातों की याद को बुलाता हूँ,
मैं बहुत सी बातों की कमी का शोक करता हूँ,
और पुराने दुखों के साथ अपने प्यार के समय की बर्बादी की रोद रहता हूँ:

तब मैं एक आँख को डूबा सकता हूं, जो बहती नहीं है,
कुन्दनीय दोस्त मौत की अविरत रात में छुपे हुए,
और पुनः नए तौर से प्यार की दुखद दु:ख कर सकता हूँ,
और बहुत सी गायब दृष्टि की लागत पर दु:ख कर सकता हूँ:

तब मैं पूर्वगत अपराधों पर दु:ख कर सकता हूँ,
और दुःख से दुःख की गिनती को भारी कर सकता हूँ
पूर्व-शोक की दुखद गणना,
जिसे मैं नया भुगतान करता हूँ जैसे कि पहले नहीं किया गया हो।

  लेकिन यदि वही समय मैं तुझे सोचता हूँ, प्रिय मित्र,
  तो सभी हानियाँ पुनः प्राप्त होती हैं, और दुख समाप्त होता है।"
"तेरा छाती सभी हृदयों से प्रिय है,
जिन्होंने मुझे कमी करते हुए मृत्यु समझा है;
और वहाँ प्रेम राज करता है, और सभी प्रेम के प्रिय हिस्से,
और वह सभी दोस्त जो मैंने दफन होने का ख्याल किया था।

कितने ही पवित्र और श्रद्धांजलि आँसू
ने मेरी आँख से प्यारे धार्मिक प्रेम को छीना,
मृतक का ब्याज, जो अब प्रकट होता है
लेकिन वे चीजें जो तुझमें छुपी हुई हैं!

तू वहाँ समय की जिंदा होने वाली कब्र है,
मेरे चले गए प्रेमीयों के झंडे लटके हुए,
जिन्होंने अपने सभी हिस्से तुझे दिए;
उनका बहुत का अब तेरा है एकमात्र:

  उनकी छवियाँ जिन्हें मैंने प्रेम किया, मैं तुझमें देखता हूँ,
  और तू, सभी वे, मेरे सभी कुछ है।"
